{
  "format": "reactorsim.reference-compact-export/v1",
  "approval_status": "unapproved_schema_example",
  "retention": "external-private",
  "publication": "not-approved",
  "case": {
    "case_id": "donjon5-afa-180-310-type1-dual-v5.1.0",
    "descriptor_sha256": "09851b1ee3155592eaa379454f2baa615af3749f82507bbb4ad526f0282a881b"
  },
  "tool_provenance": {
    "program": "donjon5",
    "version": "5.1.0",
    "source_commit": "eee582f8594d3b7d01b65660ca1e8bef00eb6b2a",
    "source_tree": "0d3e8f721c84b3c3b2d03e9898a8a0a9c29287d8",
    "executable_sha256": "e125c8bc095d9a1a7e088847b1c21b1bc37043681b6104713fa29ee1507f1a76",
    "container_image_digest": "sha256:eb8ddff7d788f563f958ada277a2c8304d2dcf829ef59a35db62438397188d79"
  },
  "observations": [
    {
      "source_ordinal": 1,
      "quantity_id": "donjon5.AFA_180_310_type1_dual.flddir.k_effective",
      "value": 0.99859273434,
      "source_lexeme": "9.9859273434E-01",
      "unit_id": "1"
    }
  ],
  "diagnostics": {
    "normal_end": true,
    "warning_codes": [
      {
        "code": "donjon5.sphapx.media_volume_missing",
        "count": 2
      }
    ],
    "assertions": [
      {
        "assertion_id": "donjon5.AFA_180_310_type1_dual.k_effective",
        "passed": true,
        "count": 1
      }
    ],
    "convergence_status": "converged",
    "convergence": [
      {
        "quantity_id": "donjon5.flddir.outer_iteration",
        "value": 15,
        "source_lexeme": "15"
      },
      {
        "quantity_id": "donjon5.flddir.dels",
        "value": 5.5e-08,
        "source_lexeme": "0.55E-07"
      },
      {
        "quantity_id": "donjon5.flddir.delt",
        "value": 8.2e-05,
        "source_lexeme": "0.82E-04"
      },
      {
        "quantity_id": "donjon5.flddir.epsout",
        "value": 0.0001,
        "source_lexeme": "1.00E-04"
      }
    ]
  }
}
